{"operation":"status","state":"fresh","versions":{"runtime":{"projection":2,"object_contract":2,"locator":2,"relation_schema":2,"parser":1,"tokenizer":1,"segment_algorithm":1},"index":{"projection":2,"object_contract":2,"locator":2,"relation_schema":2,"parser":1,"tokenizer":1,"segment_algorithm":1}},"snapshot":{"current":"sha256:aaaaaaaaaaaaaaaaaaaaaaaaaaaaaaaaaaaaaaaaaaaaaaaaaaaaaaaaaaaaaaaa","indexed":"sha256:aaaaaaaaaaaaaaaaaaaaaaaaaaaaaaaaaaaaaaaaaaaaaaaaaaaaaaaaaaaaaaaa"},"counts":{"objects":1,"relations":0,"sections":1,"segments":1,"citations":0},"changed_paths":[],"findings":[]}
